id,date,title,summary
4605441,2023-05-17,AMD: Data Center Doom Scenario Unfolding,"Two years ago, the rumor mill informed us that AMD’s 3nm Turin EPYC would have 192 cores, or 256 cores for the dense version, obliterating Intel. The latest rumors indicate that Turin has been downgraded to 4nm, resulting in a heavy core count reduction from 192 to 128 (and to 192 for the dense version). Meanwhile, Intel has significantly upgraded its Granite Rapids specs with a new node and architecture, and potentially higher core count. Overall, this means the tide is quickly turning, with Intel returning to data center leadership sooner than expected (in Q3'24). These events are fundamentally based on TSMC struggling with N3 and N2, while Intel is retaking process leadership with its aggressive 5 nodes in 4 years strategy."
4605698,2023-05-18,Intel Vs. AMD: Preparing For A Cyclical Uptrend,"Intel expects a recovery in the second half of the year as they clear large excess inventories and release new PC and server products. Intel is implementing aggressive cost-saving measures to address the deterioration of its financial results. They reduced their dividend and are lobbying for government subsidies to cover their CapEx. AMD's forthcoming MI300 data center APUs are expected to compete with NVIDIA's offerings. AMD also expects a recovery in the second half of the year, with growth in Data Center revenue due to a new product line and improvements in the PC market. The semiconductor sector remains highly cyclical, and even though predicting the next uptrend is challenging, there are reasonable grounds to expect the uptrend to start in the year's second half and surge in 2024."
4605696,2023-05-18,Does AI Translate To Risk-On Markets? With Andres Cardenal (The Data Driven Investor),"Andres Cardenal, Founder of The Data Driven Investor, is the guest of this episode. Andres has been providing research on companies that are using AI the right way. We are bringing some of those names to you in this episode."
4607166,2023-05-24,AMD: Strong AI Read Off Nvidia Earnings,"Nvidia Corporation reported blowout FQ1 2024 earnings, with a massive increase in guidance for the current quarter, which has implications for Advanced Micro Devices, Inc. AMD remains poised to ride the AI chip boom with new chips launched this year. AMD stock remains cheap, trading below 20x more normalized EPS targets with potential upside as the AI boom plays out."
4607715,2023-05-26,"AMD: Side With Wall Street, Buy The Breakout","Wall Street and Main Street have been interpreting the uncertainties and opportunities surrounding Advanced Micro Devices, Inc. very differently. I will argue for a thesis to side with the Wall Street opinion. I see AMD troubles to be temporary, and the dominating forces to be in favor of AMD’s fundamentals. AMD's recent price breakout just adds a technical reason to be bullish."
4607964,2023-05-29,AMD: Don't Be The Last One To The Party,"AMD investors got a remarkable surge last week as Nvidia's robust guidance bolstered its AI tailwinds. However, AMD's leadership in data center GPUs is not close to Nvidia's dominance. Despite that, AMD is confident of gaining more share against Intel this year in the data center CPU business. Cloud service providers might also not want to put all their eggs in Nvidia, lifting AMD's Instinct GPU series. With the surge last week, investors have likely priced in the optimism. If you board now, you could be late to the party."
4608205,2023-05-30,AMD: Better Growth Runway Than Other Competitors,"Advanced Micro Devices, Inc. has strong long-term fundamentals and is well-positioned to gain market share in the AI industry compared to Nvidia Corporation and Intel Corporation. Wall Street rewards market share movement, and AMD has shown consistent improvement, which could lead to a bullish run in the stock. AMD is a better investment choice due to its longer growth runway, lower valuation multiple, and potential to gain market share in lower-priced AI-centric chips."
4608192,2023-05-30,"AMD: Don't Kid Yourself, This Is The Time To Sell (Rating Downgrade)","Advanced Micro Devices, Inc. benefited from Nvidia Corporation submitting a blow-out guidance for the second fiscal quarter. I believe investors have an opportunity here to take advantage of the emerging exuberance. AMD’s shares are now overbought and no longer cheap."
4608843,2023-06-01,AMD: Opportunities In Generative AI And Accelerated Computing,"Nvidia Corporation has recently highlighted the $10 trillion opportunity unleashed by a multi-year upgrade cycle from CPU-only data center infrastructures to accelerated computing platforms needed to support """"computing-hungry"""" workloads. And Advanced Micro Devices, Inc. continues to demonstrate a competitive offering line-up to better facilitate related opportunities in supporting burgeoning HPC and AI demands. The upcoming launch of Instinct MI300 accelerators is expected to be a game changer in reinforcing AMD's foray in accelerated computing by complementing its growing prowess with the EPYC CPUs. Paired with an expanding software ecosystem supporting its hardware line-up, AMD is offering an increasingly competitive full-stack solution for reinforcing incremental share gains in AI and HPC over the longer-term."
4608802,2023-06-01,AMD: It Is Getting Harder And Harder To Compete,"Advanced Micro Devices, Inc.'s revenue in the datacenter segment is growing much more modestly than Nvidia Corporation's, as the competitor's chips are more tailored to AI tasks. The video game market remains a stable haven for AMD, as the company has the best price/quality product in the industry, though not the most technologically advanced. Thanks to stronger demand from data centers and the recovery of the video game market, we expect AMD to earn EBITDA of $4343 mln in 2023 and $7422 mln in 2024. Given its stable position in the video game market, but lagging behind in the data center market, we believe AMD stock is fairly valued by the market - HOLD."
4609867,2023-06-06,"After Doubling, It's Time To Trim AMD Stock","AMD stock has doubled since I purchased it near the 2022 bottom. The stock has probably gotten ahead of itself, but there is a reasonable case that can be made it's fairly valued here. I have decided to split my cyclical classification into two parts and sell half of my AMD position, treating the remaining half as a less-cyclical business."
4610004,2023-06-07,AI Cannot Be Slowed Down - With Ramy Taraboulsi And Kirk Spano,"An erudite and thoughtful conversation about AI with Ramy Taraboulsi, CFA and Kirk Spano. Neural networks, hype and building something we don't understand. Major problem with AI is lack of computing power. What stocks make sense? Lockheed Martin's quiet AI work; bearish on Google."
4610659,2023-06-10,"Stocks To Watch: FOMC, Inflation Reports, Salesforce AI Event, And Kroger Earnings",
4611316,2023-06-13,AMD: A Pause Before The Real AI Ramp,
4611191,2023-06-13,AMD's AI Event: Some Details To Watch,
4611443,2023-06-14,AMD Delivers Generative AI Vision,"GPUs have proven to be extremely adept at enabling and improving the process of training large foundation models and running AI inferencing workloads as well. At an event in San Francisco this week, AMD came out with both new GPU and CPU hardware and important new software partnerships and updates. Taken together, AMD believes these announcements will help it take a bigger chunk of a datacenter AI accelerator market it predicted will reach $150 billion by 2027."
4611824,2023-06-15,AMD: Late To 2023 Design Wins (Rating Downgrade),"We remain sell-rated on Advanced Micro Devices, Inc. after the company’s Data Center and A.I. Technology presentation. We don’t expect AMD will see meaningful A.I. revenues in 2H23. We believe AMD’s MI300 products will be used on a case-to-case basis and still cannot effectively compete against Nvidia Corporation's H100, that’s already nine months old, and its upcoming Hopper-Next GPU. Our investment thesis of AMD’s moderating share gain against Intel Corporation in PC Client and data center markets remains in play. Additionally, we believe AMD’s server CPU sales could be negatively impacted by the A.I. boom. We expect AMD's growth to lag behind Nvidia in 2H23 and 2024. We see attractive exit points at current levels and recommend investors exit the stock."
4611711,2023-06-15,Nvidia And AMD Paint The Same Growth Picture,Advanced Micro Devices CEO Lisa Su recently provided concrete estimates for the AI accelerator market. These estimates broadly align with Nvidia Corporation CEO Jensen Huang's recent comments. I consider the implications of AMD's new estimates for Nvidia and AMD's valuation and growth.
4613056,2023-06-22,AMD: Pullback Creates Buying Opportunity,
4613013,2023-06-22,AMD: Flexibility Is Key,"Despite the lackluster investor response to their AI presentation, we believe the future is bright for Advanced Micro Devices, Inc. AMD is well-positioned to take advantage of computing trends due to their modular architecture and design philosophy. The company has the flexibility and open-mindedness to thrive in the coming age of AI."
4613603,2023-06-26,Wall Street Is Sleeping On AMD: A Surprisingly Forgotten Generative AI Winner,"Nvidia Corporation keeps rallying and rallying but Advanced Micro Devices, Inc. is not getting the same love. AMD maintains a net cash balance sheet and solid profitability, but conservative guidance has spooked investors. The company appears behind Nvidia in AI but I expect it to catch up rapidly. The generative AI market opportunity is enormous and I expect there to be many winners, AMD among them."
4613864,2023-06-27,AMD: Buy Before It's Gone Again (Rating Upgrade),"Advanced Micro Devices buyers who chased its May surge have been punished. I cautioned previously that its valuation and price action were no longer constructive. AMD has pulled back nearly 20% from its recent highs, creating another opportunity for investors to buy at more attractive levels. AMD's AI ramp remains on track, with supply chain partners corroborating the optimism. As such, investors who didn't manage to buy before the crazy surge are given another opportunity to get on board."
4613877,2023-06-27,5 Things Smart Investors Should Know About AMD Stock,"Advanced Micro Devices, Inc.'s quarterly revenue has been dropping. AMD's price peaked in 2021. The Amazon AWS unit is looking at AMD's new MI300 GPU chip for its servers."
4614497,2023-06-29,AMD Stock Has Reached Dangerously High Levels,"Advanced Micro Devices, Inc. shares may be overpriced due to market exuberance surrounding the data center industry and AI boom, with a high P/E ratio of 49.62x. The company's financial performance shows a decline in revenue and EPS, as well as challenges in the client segment and acquisition-related expenses. I present my bearish thesis for the company."
4614457,2023-06-29,AMD Is Cheap Again - Strong AI Buy Here,"I discussed a probable bottom around the $50-60 range in AMD's stock in my last AMD article. AMD has made an epic comeback, yet the recent selloff creates an excellent buying opportunity. AMD has significant potential in AI, which should enable it to strengthen its core businesses while creating new revenue streams in future years. AMD's stock is a strong buy here, as the company has enormous revenue growth and profitability potential. This dynamic should enable AMD's stock to advance in the coming years."
4614328,2023-06-29,Is Nvidia In A Class Of Its Own? Cameron Fen With James Foord,"Implications of AI and large language models for big tech companies, with a focus on Nvidia. Cameron Fen, a PhD student in economics who specializes in machine learning, explains how these models work and their potential impact on the tech industry. Fen suggests that big tech companies like Google, Amazon, Facebook, and Microsoft will benefit from large language models due to their access to vast amounts of data. However, he expresses concern about the potential cost implications for Google Search if it starts using large language models. The discussion also touches on Nvidia's market position and valuation, with Fen arguing that even if Nvidia captures 100% of the market, it may not be enough to justify its current market cap. He also mentions potential competition from companies like AMD and Google if they develop their own versions of Nvidia's CUDA language."
4614706,2023-06-30,AMD: Potential Buy Opportunity At Key Level (Technical Analysis),"The global AI accelerators market is predicted to grow in the next five years, providing Advanced Micro Devices, Inc. with significant growth opportunities. Despite a significant rally in its stock price, AMD holds potential for further growth, underpinned by diversification into AI, gaming, and cloud services. AMD exhibits a robust bullish trend, evidenced by the formation of an inverted head and shoulders pattern."
4614608,2023-06-30,AMD Has A Massive Edge In Research,"Advanced Micro Devices, Inc. has expanded its R&D efforts in the last five years as its revenue growth improved. This has reduced the gap between Intel Corporation and AMD in terms of resources diverted towards research. AMD along with chip producer Taiwan Semiconductor should be able to overtake Intel in terms of R&D expense by 2025. Intel’s ability to beat AMD in terms of chip leadership might not happen, as the company cannot expand its research efforts without massively hurting the bottom line. AMD has delivered better bang for the buck within the research department, and this will increase in the future as R&D resources increase."
4615590,2023-07-06,AMD: Market Miscalculates Its AI Potential And Will Regret That,"Compared to other leaders, Advanced Micro Devices, Inc. seems to be left behind in the AI wave so far. In my view, the market underestimates the potential of its AI-oriented products, especially its MI250 chips and the associated software support. Beside AI products, AMD’s chips also offer several unique technological advantages to remain competitive for general computing."
4615769,2023-07-07,AMD's Breakthroughs At AI Tech Premiere,"Advanced Micro Devices, Inc. is enhancing its competitive edge in the CPU and GPU markets through its Ryzen, EPYC, and Radeon Vega platforms. AMD's recent Data Center & AI Tech Premiere showcased an impressive lineup of products designed to address a wide range of data center and AI applications. The diverse range of products exhibited at the event is expected to generate solid revenue growth for AMD. The company is poised to gain market share and capitalize on the expanding demand for AI technology in various industries."
4616068,2023-07-10,AMD: Unlocking AI Potential At A Fraction Of Nvidia's Price,"Advanced Micro Devices, Inc. is emerging as a viable alternative to Nvidia Corporation in the AI market, with its Instinct product line and MI 300 chip offering potential higher returns to investors. AMD's valuation is more attractive than Nvidia's, trading at 21.24x its projected EPS for 2025 compared to Nvidia's 33.96x, and 39.28x forward P/E compared to Nvidia's 54.64x. Despite Nvidia's current dominance, AMD's strides in AI, and projected growth in the GPU market, we believe AMD stock could see it reach new all-time highs soon. We believe there to be emerging alternatives to Nvidia's moat when it comes to CUDA, with certain large players already trying to break Nvidia's stronghold in the AI market."
4616318,2023-07-11,AMD Strides Into The AI Battlefield: An Opportunity Or A Challenge?,"Advanced Micro Devices, Inc. is making strategic moves to capitalize on the growing demand in the AI and HPC markets, unveiling its AI/HPC native GPU solutions, the MI300X, and the OCP-based Instinct Platform. AMD's MI300X GPU variant and the OCP-based Instinct Platform are set to ramp up by the end of 4Q23, offering industry-leading memory configuration and bandwidth, potentially outperforming NVIDIA's solutions. Despite promising advancements, AMD faces challenges in competing with Nvidia Corporation's CUDA technology, which is the industry standard for GPU-accelerated computing."
4616560,2023-07-12,AMD: Most Of Upside Has Been Realized,"Tech valuations are high, but that doesn't necessarily mean that tech will fall. I debunk two bearish arguments that suggest we're in a tech bubble. I also present the case for Advanced Micro Devices, Inc. as a core position in my portfolio and guide readers towards a reasonable price target."
4617508,2023-07-17,AMD: More Downside Risk Than Upside Potential,"The semiconductor industry demand recovery will likely not happen in 2023 as anticipated. Many data points from the manufacturing sector and multiple semiconductor market peers support this claim. In anticipation of the long term, Advanced Micro Devices' valuation may have risen too drastically without considering the near-term industry conditions."
4617782,2023-07-18,AMD: What To Do Ahead Of Q2 2023 Financial Report,
4618825,2023-07-21,Nvidia And AMD: AI Updates From Taiwan Semiconductor's Q2 Earnings,"Taiwan Semiconductor Manufacturing Company Limited's earnings commentary regarding AI growth is very positive for both Nvidia Corporation and Advanced Micro Devices, Inc. Although capacity constraints may limit growth in AI chips sales in the very short term, TSMC expects rapid and sustained growth over the next few years. AI chips already account for one-eighth of TSMC's revenue from advanced nodes, indicating that computing is rapidly evolving toward AI-related applications."
4619297,2023-07-24,AMD And Intel: Data Center CPU Update From Taiwan Semiconductor's Q2 Earnings,"During recent earnings commentary, Taiwan Semiconductor Manufacturing Company Limited suggested that AI chip sales are likely to cannibalize data center CPU sales in the short term—which could negatively impact Advanced Micro Devices, Inc. and Intel Corporation. The cannibalization of data center CPUs could be an unplanned headwind for AMD and Intel due to higher-than-expected AI accelerator sales from Nvidia. Cannibalization risk may be more significant for Intel due to AMD's superior offerings."
4621586,2023-07-30,AMD: Strong Read From Intel,AMD investors got a strong read from the Intel Q2'23 results posted last week. The chip company could face some near-term data center pressure leading to long-term AI opportunities. AMD stock is cheap at ~20x normalized EPS levels while the AI market provides substantial growth ahead.
4621790,2023-07-31,AMD: A Win On Price And Flexibility,"There are strong signals that Advanced Micro Devices, Inc. will gain market share in the AI space as cloud providers try different options. AMD wins in many AI segments when we consider metrics based on branding, price, flexibility, and tech. MosaicML recently released results that show AMD’s MI250 delivered results that were within 80% of Nvidia’s A100 chips. The cloud providers are themselves facing intense competition which should force them to look for cheaper and more optimal options. Even a single big client can build strong bullish momentum in AMD stock."
4621764,2023-07-31,AMD: Case For Loading Up Before Earnings,"Advanced Micro Devices, Inc. buyers are steadfastly holding the $110 level, likely anticipating a robust earnings release on August 1 (post-market). Intel's recent earnings release was robust and helped to de-risk AMD's outlook for the second half significantly. AMD has not benefited significantly from the AI chips hype, as it looks to ship its upgraded MI300 series from Q4, challenging market leader Nvidia. A lack of capacity at foundry Taiwan Semiconductor could hurt AMD's near-term outlook. However, I believe any unanticipated capacity shortfall should be sorted out in time. I make the case for why high-conviction investors should load up before AMD releases its results after the market closes on August 1. Read on."
4622414,2023-08-01,AMD: Consider Selling The Q2 Report (Rating Downgrade),"Advanced Micro Devices, Inc. Q2 revenues of $5.36 billion beat reduced estimates and were down 18% YoY. Client and Data Center segment revenues fell, while the Embedded segment showed 16% growth. AMD guidance for Q3 missed street estimates, leading to concerns about future growth and competition from Intel."
4622165,2023-08-01,AMD: Still Winning,
4622133,2023-08-01,AMD Q2 2023 Earnings Preview: Some Themes To Watch,"Advanced Micro Devices reports Q2 2023 earnings after close today, August 1, 2023. This article discusses three key themes that investors should follow. Doing so should help investors better evaluate AMD's future prospects."
4623376,2023-08-03,AMD: Upgrading To Buy In Hopes Of An A.I. Boom Possibility,"We’re upgrading Advanced Micro Devices, Inc. to a BUY in the hopes of an AI boom possibility. Clearly, the near-term muted cloud/enterprise capex spending and the industry pivot to A.I. servers had a negative impact on AMD's datacenter financial performance resulting in lowered FY2023 outlook. Additionally, AMD's results and guidance confirmed our thesis of moderating share gains against Intel. While we still believe AMD’s A.I. accelerator offerings will lag behind Nvidia Corporation’s, we see more wiggle room for AMD to navigate due to the severe shortage of Nvidia's supply. We now recommend investors explore favorable entry points on this pullback, as we expect AMD to ride the A.I. trend into 2024."
4623187,2023-08-03,AMD: Solid AI Product Roadmap Solidifies Leadership Position,"The data center segment was mixed as cloud spend optimization continued and enterprise remained weak while Genoa and AI provided tailwinds to the business. Client segment was weak as expected but management expects strong growth in the second half of 2023 due to seasonality and a strong product portfolio. AMD's Instinct MI300X GPUs, which is meant to rival Nvidia's GPUs, is launching and ramping production in the fourth quarter of 2023. Management stated that customer interest for MI300X is """"very high"""" and engagements expanded significantly in 2Q23. I would enter AMD at $84, which is at a 20% discount to my intrinsic value of $105."
4623893,2023-08-04,AMD: Generative AI Gains Have Yet To Materialize,
4624898,2023-08-07,"AMD: It's Not Just When To Buy, But When To Sell","Our last two articles to the readership had """"buy"""" ratings and led to nice gains. Now we shift to a more protective stance. Let’s look at the fundamentals with Lyn Alden to show us the current backdrop. Do you have a trading/investing system in place? We share what we use to help garner profits while protecting capital in AMD and other names."
4625293,2023-08-08,AMD And Nvidia: Engagements Vs. Invoices,"Advanced Micro Devices called its AI aspirations """"engagements"""" on its earnings call, but engagements don't bring in revenue. Engagements are merely proof-of-concepts and may not lead to sales. Nvidia Corporation continues to bring in revenue invoices with its complete H100 AI package in hardware and software. Until AMD gets through its """"long journey"""" in software, Nvidia's products should remain on top, especially with Hopper-Next releasing while AMD just begins ramping MI300."
4627339,2023-08-11,AMD: Best AI Investment Available,"Advanced Micro Devices, Inc.'s AI opportunity is massive, with the potential for significant growth in revenues throughout 2024. AMD Instinct MI300 accelerators are competitive with Nvidia Corporation's H100, offering superior performance for large model inference applications. AMD's EPYC server processors and Ryzen AI processors are well-positioned to capitalize on the growing interest in AI, with the potential for significant market share and sales growth in 2024."
4629067,2023-08-16,AMD: On The Verge Of A Bear,
4630064,2023-08-21,Advanced Micro Devices: More Overvalued Than You Think (Rating Downgrade),"AMD's stock has experienced a +65% price gain during calendar 2023, driven by excitement in Big Tech and enthusiasm for AI semiconductor picks. High and rising interest rates present a unique, no-risk alternative for investors in extended-valuation growth names. Overvaluations on underlying business results are again near the record levels of 2021. The stock appears to give no weight to a looming recession into 2024, and the adverse repercussions to sales and profitability next year."
4630716,2023-08-24,AMD: Strong Read From Nvidia's AI GPU Surge,"Nvidia reported explosive AI GPU sales growth and signals supply will support higher growth going forward. Advanced Micro Devices' competing AI GPU chip, MI300, is set to hit the market in Q4 and has significant capacity secured. The company has significant upside with analyst estimates not factoring in massive upside potential from AI GPU sales. AMD stock is cheap at closer to only 20x '24 EPS targets."
4631204,2023-08-25,AMD Is Not Worth Buying,"AMD's data center revenue fell 11% in Q2 2023, while Nvidia's data center revenue grew by 171%. AMD fails to offer any meaningful product differentiators that would enable it to take market share from Nvidia in our view. Given AMD's competitive disadvantages, it is unlikely to enjoy the kind of profit margins that Nvidia has."
4631192,2023-08-25,"AMD And Nvidia: 2 Long-Term Winners Of Generative AI, But Only One Is A Buy",
4631161,2023-08-25,AMD Is Stalling,
4631135,2023-08-25,AMD: Doubling Down Opportunity As Investors Fled,
