id,date,title,summary
4413689,2021-03-13,"Stocks To Watch: Nike, FedEx, Rising Yield Plays And A Sports ETF",
4414093,2021-03-15,AMD: If You Sell Now Then You Might Leave Money On The Table,"AMD is not as vulnerable to the chip shortage as previously believed. As AMD is expected to deliver over 50% revenue growth in 2021, but its chip capacity can only increase by 20%. Potentially, 30% of the orders may not be filled. When chip capacity expansion catches up with the sales growth, AMD will get out of the tight supply by September 2021. AMD has been traded at a 15% discount compared to the Street's target prices since the last earnings call. Investors may have overreacted to the short-term supply shortage. Since unfilled orders are only delayed but not gone, selling AMD at such a discount is equivalent to leaving money on the table."
4414182,2021-03-16,AMD Refocuses On Business With Latest Epyc And Ryzen Pro Launches,"AMD has been building up its business-focused offerings, as evident from the back-to-back launches of its latest third-generation Epyc server CPUs and its Ryzen Pro 5000 series mobile processors for enterprise notebooks. While each of the new chips is optimized for their very different needs and applications, they do share a number of enhancements that are at the heart of Zen 3 cores, including larger, unified caches for faster processing with larger data sets. This new architecture makes it easier for multi-threaded applications capable of simultaneously using all those cores to fully leverage the full cache, resulting in significantly improved performance for these types of programs. In addition to performance enhancements, AMD added several hardware-based security improvements, which are becoming increasingly important for businesses of all sizes."
4415096,2021-03-19,"AMD, At Its Current Valuation, Has The Ability To Drive Shareholder Rewards","AMD is growing incredibly rapidly, backed by the best lineup of products in the company's history. We expect the company to continue growing, increasing its revenue substantially in the upcoming years. AMD's financial picture more than justifies the valuation, and we expect the company's CPU and GPU revenue to continue growing."
4415574,2021-03-23,AMD: Overblown Intel Risk,
4415743,2021-03-24,Xilinx And AMD - Making The Sum Worth More Than The Parts,We look at some of the business scenarios for AMD in acquiring Xilinx. We provide some context for the acquisition by looking at the history and economics of FPGAs. We analyze some of AMD’s technical and financial claims for the acquisition.
4416662,2021-03-29,AMD's Stock May Still Have Much Further To Fall,"AMD's stock has fallen by more than 20% since the middle of January. The stock has struggled under the weight of the deal to acquire Xilinix. There may be another leg lower left to come, pushing shares to as low as $62."
4417347,2021-04-03,Stocks To Watch: Chip Talk From Intel And Applied Materials,
4417828,2021-04-06,AMD's Shares May Have Priced In Milan's Future Success,"AMD’s Milan server CPU can achieve an impressive performance improvement by design shifts alone, without the move to a lower manufacturing node. Milan looks to increase AMD’s server market share by 1%-2% a year and propel 2021 revenue growth over 40%. Without Milan, AMD shares may be overvalued at the current $81, per linear pricing on forecasted fundamentals. With Milan’s exponential growth potential, AMD may be valued around $83, before the $10 accretion from Xilinx’s merger. AMD’s current price may have priced in Milan’s success."
4418674,2021-04-12,AMD: Still A Buy,"The Xilinx acquisition is to AMD what the Altera acquisition was supposed to be. There is a steady, emerging shift toward AMD in the datacenter segment. The supply constraints in the semiconductor industry are beginning to loosen, which will directly benefit AMD. Overall, I recommend buying AMD, selling puts, and/or engaging in a pair trade with Intel, AMD being the long leg."
4419805,2021-04-19,AMD: Still Great Prospects,"AMD's share price has corrected in recent months after last year's rally and is now 15 percent below its all-time high. This correction was overdue. Looking ahead, I see further upside potential for shareholders, although the picture is no longer quite as promising as in recent years. The share price still needs some time to reach an appropriate valuation, which could be the case in two years. If the company manages to maintain its strong market positions and address the growing future markets with innovations and competitive products, long-term investors will find an investment that is currently not excessively overpriced."
4420303,2021-04-21,AMD: Buy The Pullback,
4421064,2021-04-24,"Stocks To Watch: Apple, Tesla And Microsoft Lead Huge Earnings Week",
4421357,2021-04-26,AMD: Start Looking Out,AMD will be reporting its Q1 results on April 27. Analysts are estimating its revenue for the period to come in at $3.21 billion. Investors with a long-term time horizon may want to accumulate AMD on dips.
4421780,2021-04-27,AMD: Intel Risk Dispelled,AMD smashes Q1 financial targets. The company provides guidance for 50% revenue growth in 2021 leading to a $2.10 EPS target. The stock should easily top $100 with 2022 EPS estimates eventually topping $3 with the accretive Xilinx deal.
4422590,2021-04-29,AMD: It's On You If You Don't Buy The Dip,"AMD had a miracle 1st quarter, and the firm built on previous gross margin gains. Revenue growth accelerated in the 1st quarter, and AMD raised its FY 2021 revenue guidance. Continual sales growth driven by a strong product line-up indicates more upside."
4423627,2021-05-02,AMD Has Become Undervalued,"AMD had a solid Q1. In fact, accelerated growth in the wake of the stock sell-off/plateau might have caused a short-term undervaluation. Long-term, increased competition from Intel clouds visibility. Article also demonstrates that cloud digestion is real. Management’s refusal to address its cloudy earnings segments unnecessarily obfuscates performance. Given AMD's higher growth rate, it is quickly approaching Nvidia's revenue levels despite almost 4x lower market cap."
4424203,2021-05-04,AMD: Here's Your Opportunity,Shares slide despite very strong earnings report. Xilinx deal will help to offset growth slowdown concerns. Technical pressure should reside in the near term.
4424694,2021-05-05,AMD: Epyc Milan Is Even More Epic Than You'd Think,"AMD was overpriced, but fundamentals are quickly catching up to its valuation and provide investors with an entry opportunity. AMD Epyc Milan annihilates Intel's current offering and becomes the go-to-guy for data centers. Network Function Virtualization is an aspect the market is not fully pricing into AMD's Epyc offering."
4424579,2021-05-05,Can AMD Stock Price Reach Nvidia's Levels,"Despite blockbuster quarterly results, AMD’s share price has fallen double digits year to date. Fierce competition from NVIDIA, as well as the possibility of a revived Intel may be cause for the drop in the stock. However, recent developments could drive the shares higher."
4425011,2021-05-06,Intel And AMD: X86 Faces Obsolescence II - State Of Play,"This is a follow up to my original article on x86 obsolescence. More relevant developments have taken place since then. The developments imply the thesis is already producing effects, and things will accelerate quickly in 2022."
4428407,2021-05-13,"AMD: The More It Drops, The Greedier I Get",AMD is making massive advances in the server business. AMD’s server business has a lot of potential after new information showed gains in this lucrative market. AMD is a buy on every drop.
4430298,2021-05-20,AMD: Thank You,
4430142,2021-05-20,AMD Buyback A Strong Signal,The company announces a $4 billion repurchase program. Plan may offset some of the Xilinx dilution. Management showing faith in a strong financial position.
4430607,2021-05-21,AMD: Not The $4 Billion Reasons To Own,"AMD announced a $4 billion share buyback cheered by the market, yet only amounting to 3% of the combined company once adding Xilinx. The combined company expects billions in additional revenue by 2023 in comparison to when the merger was announced just in October. The stock is cheap as 2022 EPS estimates start pushing toward $3."
4430464,2021-05-21,AMD: Cell Phone Domination (The Hidden Catalyst),"Samsung commands 23% of the global cell phone market and the AMD deal from 2019 is about to bear fruit. Consumers have overlooked this little talked about deal. Once they wake up to the fact that 23% of the cell phone market is tapped by AMD, the hype will start. Ignoring the CPU market, it is this cell phone hype which might offer an unexpected bonus to investors acquiring AMD at the current depressed prices."
4430941,2021-05-24,AMD: Still Too Expensive,"AMD continued to deliver astonishing top line growth numbers over the past year, reaching more than 90% in the last quarter. Contrary to the outstanding operational performance, share price underperformed the market on a risk-adjusted basis. High-growth expectations already built into the price are largely to blame, while the cyclical nature of the industry should also be considered."
4431944,2021-05-28,AMD And Snowflake: Best In Class,"I performed old-fashion bracket tests to select the best one of the four stocks to buy now. The goal is to make the largest return by 2021. Mainly near-term sales and margin forecasts are used to differentiate the near-term share performances of four high-water mark tech stocks. INTC and AMD are in the same bracket for obvious reasons. By 2021, AMD most likely outperforms INTC. SNOW and PLTR had a very similar triple-digit lifetime performance just months after their IPO. Yet, SNOW may beat PLTR. In the end, AMD most likely beats SNOW. AMD may be the best near-term performer among the four tech stocks."
4432695,2021-06-02,AMD: Advanced Marketing Devices,
4434071,2021-06-10,AMD Stock Forecast: What Might The Price Be By 2025,"AMD has delivered outsized returns over the last five years, but shares have underperformed the market in 2021 so far. The current consolidation pattern could remain in place for a while, until business growth catches up to AMD's above-average valuation. Thanks to a solid long-term growth outlook, shares of AMD have significant upside potential through 2025, but investors shouldn't expect returns like the ones seen since 2016."
4434592,2021-06-13,AMD Continues To Win,"AMD's technological dominance and business momentum show no sign of slowing down. Yet, skepticism around the stock has been increasing. However, as long as Intel lags over the next two years, AMD should continue to do well."
4435350,2021-06-17,AMD's Stock May Struggle To Advance Despite Bright Outlook,"AMD's stock has the Xilinx dilution still weighing on it. However, once the deal is finalized the stock could lift given its bright growth outlook. The stock's valuation has come down dramatically making the shares more compelling."
4435634,2021-06-19,"Nvidia Is A Real Threat, But AMD Has Proven Its Mettle",
4435901,2021-06-21,AMD Is Headed For A Breakout If Xilinx Merger Is Approved,EU and UK regulators are currently reviewing the AMD/Xilinx merger. Approval from both regulators will be received in the next three weeks. China’s antitrust agency will take considerably longer to review the deal. AMD urgently needs a catalyst and EU/UK merger approval could push AMD out of its sideways trading range.
4437356,2021-07-01,Intel's Ongoing Delays Mean AMD Is Set To Dominate x86 Server Technology Through 2023,"Intel announced yet another delay - this time it is the next-generation x86 server product, Sapphire Rapids. A review of Intel and AMD product roadmaps suggests that Intel will continue to lag for at least another couple of years. Investors expecting CEO Pat Gelsinger to miraculously turn around Intel will be disappointed. It will take many years for the Intel ship to turn around."
4438212,2021-07-08,AMD Vs. Micron Technology Stock: Which Is The Better Buy?,"Our lives are dependent on technology and data, and that will be even more the case in the future. This provides natural tailwinds for all semiconductor companies. Both Micron and AMD have been strong performers in recent years, business-wise and when it comes to share price gains. There are significant differences when it comes to cyclicality, future growth, and valuations. Investors should consider those before making an investment choice."
4438221,2021-07-08,AMD: Xilinx Deal Continues To Hold AMD's Price Down,"Xilinx DCG (Data Center Group) is only 7% of its revenue. FPGAs are a cyclical business and Xilinx's history shows that. Saving $300 million a year via """"operational efficiencies"""" seems unlikely. More fuzzy math on the claim that EPS will increase after the deal even including the $4 billion buybacks."
4438865,2021-07-12,AMD: Executing A 'Winning' Plan For Growth,"AMD's diversified product pipeline continues to drive broad-based growth across all segments of their business. Global PC demand remains elevated, a direct result of society's adaptation to the COVID pandemic. Notebook demand, coupled with material market share gains, has led to record mobile processor sales. High profile contract wins in the Enterprise, Data Center, and High Performance Computing (HPC) verticals highlight successes in AMD's fastest-growing market segment. I'm """"very bullish"""" on AMD, with a conservative five-year price target of $182 on the shares. We currently hold Advanced Micro Devices, Inc. in the Premier Growth strategy."
4439765,2021-07-18,AMD: On The Road To $5 Billion In Annual Free Cash Flow,"The semiconductor company is poised to report impressive revenue growth for Q2’21 on Tuesday, July 27. AMD’s gross margin could be even higher than guidance due to beneficial shifts in product mix, meaning AMD likely sold more higher-priced CPUs and GPUs in the last quarter. Q2'21 free cash flow could be up to $900M. AMD could see more than $5.0B in free cash flow next year based on accelerating EPYC Milan sales."
4440150,2021-07-20,AMD: Suddenly Cheap,AMD has struggled since topping $80 last August. Analysts are now forecasting surging earnings as AMD takes substantial market share in the server space. The stock trades at only 15x high-end '23 EPS targets which will make AMD suddenly cheap.
4440407,2021-07-21,Intel Vs. AMD: Hourglass Model Predicts The Future,Intel and AMD's earnings are ahead but the outcome is predictable. Hourglass model shows how market share is moving from Intel to AMD steadily and how value is shifting at a more accelerated rate. Current market share and value transfer trends are likely to continue for another couple of years at least.
4440564,2021-07-22,Is AMD Stock A Buy Or Sell Before Upcoming Earnings?,"AMD has a history of beating estimates, but the share price reaction to an earnings beat is not necessarily a positive one. What investors can expect from the upcoming Q2 report. AMD offers high growth and is active in an attractive industry, but shares are pricy, which will likely eat into future returns to some degree."
4441178,2021-07-24,"Stocks To Watch: Apple And Tesla Lead Earnings Blitz, New IPOs And SPAC Debuts",
4442271,2021-07-28,AMD: Logically Cheap Now,AMD smashed Q2 analyst estimates with revenue growing nearly 100%. The company guided to 60% revenue growth in 2021 and should top $20 billion in sales next year. The stock trades at only 16x much more logical 2023 EPS targets.
4442043,2021-07-28,AMD Is The New Bellwether,AMD's earnings report on Tuesday has pushed me over the edge as to where my money needs to be. The revenue growth and valuations prove the market wants one thing: Growth. Intel has lost the bellwether title as it grows below the industry and AMD grows above it.
4442955,2021-07-30,"AMD: Still Growing, Still Undervalued","AMD's margin gains are driven by growing strength in end markets. AMD raised its revenue guidance by $1.0B for FY 2021 and gross margins are edging closer to 50%. The semiconductor firm could be a $6.0B free cash flow business next year, even if growth slows down. AMD's dollar sales growth is cheaper than Nvidia's and AMD might even grow faster."
4443794,2021-08-01,Nvidia Vs. AMD And Qualcomm: How To Analyze Semiconductor Stocks For Your Portfolio,"Semiconductors are a hot commodity in many industries and on Wall Street. This article dives into three of the most widely followed semiconductor stocks on Seeking Alpha. We’ll weigh the bull and bear cases – then get to the bottom line on NVDA, AMD, and QCOM according to the top five predictive factors of stock performance."
4444164,2021-08-02,AMD: Sell If You Really Believe,"Revenue growth cliff has now come, excluding Xilinx. Xilinx premium hits new high as deal completion nears. Stock well above short-term moving average."
4444368,2021-08-03,AMD Eats More Cake,"AMD had a great quarter, and the stock price was appropriately rewarded with a price surge. The company is not as supply-constrained as the market thought it would be. Long-term investors should keep locked in on the bigger narrative. A $79B TAM that is not as outlandish, with a $30-$40B data center opportunity. AMD is still scratching the surface. Supply constraints may well continue to pose challenges. We should weigh the odds of middling short-term growth against financials and valuations. At an NTM EV/S of 7.7x and NTM EV/EBITDA of 30.3x, multiples are reasonable despite the uncertain supply scenario. The Abstract Portfolio is long AMD."
4445289,2021-08-05,Xilinx: AMD Spread Blows Out,"Xilinx shares decline as acquisition hopes fade. Spread to AMD buy price soars to new highs. If no deal, look for meaningful share buyback."
4446071,2021-08-06,AMD: Is The Party Over?,"AMD's stock has become parabolic after breaking out post earnings. While the future does look bright for the company, the recent move and interest from the """"meme"""" stock mob is making even long-time bulls a little uneasy. Is the party over or is there still room to keep dancing?"
4446030,2021-08-06,AMD Stock Looks Like A Beast Post-Earnings,"AMD is a top semiconductor stock with strong growth and high profit margins. The stock rallied after its second quarter earnings release, which beat expectations. Lately AMD has been gaining on its chief rival, Intel. In this article, I present a bullish thesis on AMD, arguing that it still has plenty of market share to capture and future growth to enjoy."
4447219,2021-08-09,Xilinx: Downside Risk Appears Overstated,
4448219,2021-08-11,AMD: Don't Worry About The Xilinx Deal,"AMD outperformed in 2021 as business growth accelerated. Most recently, AMD dipped on fears that the Xilinx merger might not get approved. AMD is in the strongest position it has ever been in. Even if the deal doesn't go through, AMD will do fine as it launches new GPU products. AMD just brought a new high-performance GPU to market which has the potential to boost AMD's revenue growth even without Xilinx."
4448881,2021-08-12,The Growing $432.23 Billion Medical Devices Industry Can Boost AMD,"The stock of Advanced Micro Devices is +969.38% since my April 24, 2018 buy recommendation. I’m still endorsing it as a buy. My May 2021 CT scan can result said there are inflammatory vs. metastatic nodules in my right lung. This should convince us all AMD has a growth catalyst in medical. Ryzen Embedded is being marketed for  medical imaging applications. RDA2 Radeon embedded GPUs are great for medical monitors. Unlike with Intel, there’s no metastatic skepticism on AMD right now. Seeking Alpha’s Quant AI algorithm is Very Bullish on AMD. Success in embedded processors can offset AMD’s inability to challenge Nvidia’s big lead in consumer and data center discrete GPUs."
4448637,2021-08-12,"AMD, Intel, And Nvidia: Which Is The Best Chip Stock?","AMD's recent CPU and GPU offerings have been more competitive with Intel and NVIDIA's products. AMD’s EPYC server chips have proved to be comparable or even superior to certain Intel chips and have led to AMD gaining server CPU market share. Even so, Intel is the leader in the processor market and holds long-term advantages over AMD in R&D, marketing, and pricing. Nvidia is ahead of AMD in GPU technology and is leveraging its GPUs into adjacent end markets such as artificial intelligence."
4449217,2021-08-13,"Under My Optimistic-Case Scenario, AMD Is Worth $150",
4454997,2021-09-13,AMD: Major Change In Sentiment,"The early August bubble burst rather quickly. Short interest has come down significantly. Xilinx spread has narrowed, 50-day moving average in sight."
4455444,2021-09-15,AMD: Steaming Ahead With Data Center Chips,
4455373,2021-09-15,AMD: Limited Upside With Lofty Expectations,"AMD has been a solid gainer as it scooped up market share and introduced new products. Their balance sheet is superb and ready to take on industry consolidation with a medium or large company acquisition. But their current lofty share price and net income expectations point to limited upside over the next 24 to 36 months. As a result, I remain bullish on industry growth but have turned neutral on the company's return on investment potential."
4455692,2021-09-16,AMD Stock: Strong Momentum And Path To Strong Compounded Annual Returns,"In the dark days of 2015 and 2016, AMD traded for less than $3 and the company was loaded down with junk bonds. Today, AMD's tech is getting positive reviews, the balance sheet is cleaned up, and there are big opportunities to continue grabbing market share in data centers. AMD just raised revenue and margin guidance, with some analysts expecting AMD to earn as much as $7 per share by 2024. Why momentum investing works and how to execute it with AMD."
4455588,2021-09-16,AMD Stock: One Of The Best Secular Growth Plays In The Semiconductor Industry,
4456209,2021-09-20,Inefficiency Of AMD-Xilinx Merger Arbitrage Provides A High ROI Opportunity,"AMD deal with Xilinx could be cleared by as little as 2 weeks. Even a Phase III review is unlikely to delay it much past November. Xilinx has an unusually high deal discount for an impending deal and provides a good opportunity for investors. This article discusses the history so far, the likely scenarios, and implications."
4456206,2021-09-20,AMD: Price War Won't Matter,
4456158,2021-09-20,Is Now A Good Time To Buy Or Sell AMD Stock? Taking Partial Profits Seems Sensible,"AMD has made huge strides in the data center business against Intel. However, it had to surrender some gains in the Desktop business. Nevertheless, its stock has underperformed the market this year, as investors parsed its future opportunities. It isn't smart to bet against AMD. But, it may also not be wise to dismiss Intel's and Nvidia's challenges. The company needs to navigate its foray into ARM-based chips where it does not have proven leadership. Given its valuations and price action, we think it's a good time for investors to lock in some gains."
4456428,2021-09-21,The Market Is Wrong About AMD,"Shares of AMD have declined 17% since they peaked in August. The market appears fixated on the AMD-Xilinx merger. However, AMD continues to make inroads in the server market and a strong product lineup is poised to power AMD’s growth beyond 2022. AMD's free cash flow prospects are improving."
4457363,2021-09-27,AMD And Intel Offer Similar Returns - Focus On The Risks,"Semiconductor stocks benefit from long-term tailwinds, but steep returns are not guaranteed. INTC and AMD will deliver high-single-digits returns in the coming years, I believe, but due to different reasons. The two companies come with different risks, and investors may want to decide what type of risk they are willing to take on."
4457265,2021-09-27,AMD's Decelerating Growth Rate May Lead To A Sharp Decline,"AMD's growth is expected to slow dramatically over the next 2 years. The stock appears to be fairly valued on the surface, but slowing growth changes that outlook. This could lead to a reset in the valuation."
4458561,2021-10-05,AMD Stock Forecast: What To Watch For The Rest Of 2021,"AMD stock price has increased by only 9% this year and underperformed the key benchmark stock indices over the same period, as a result of valuation multiple compression. AMD is expected to deliver strong top line and bottom line growth for the full year, but a slowdown in 2H 2021 vis-a-vis 1H 2021 is inevitable. AMD is a Hold, and I will watch out for wafer prices and potential competition for the rest of 2021."
4458744,2021-10-06,Intel Vs. AMD: Competitive Prospects,"This is a (very) long look into the competitive positioning between Intel and AMD, on the CPU/SoC side, over the next 2+ years. It covers the desktop, laptop and server segments. There are changes happening, and more will be coming, to this competitive positioning."
4459252,2021-10-10,AMD: Prepare For A Selloff,"AMD is the shining star of the semiconductor sector from many fundamental viewpoints. Every victory for AMD is a setback for Intel; the converse is also true. AMD is 100% to 229% overpriced relative to the market, depending on whether you account for its tax benefits. October has consistently been a losing month for AMD. Profit from (or protect your holdings from) the statistically likely pullback via a bear ratio spread."
4459356,2021-10-11,"The CPU Shortage Has Ended, Benefiting Advanced Micro Devices","Server unit shipments and market share are performance-sensitive and independent of ASPs. In the server CPU sector, AMD and Intel seem to be leapfrogging each other by introducing a “superior chip” on almost a quarterly basis. The battleground in the server sector is no longer with the chip designers, but whether Intel can make its own CPUs at <7nm nodes."
