id,date,title,summary
4237167,2019-01-31,AMD: No Hangover After All?,"AMD reported Q4 financial results mostly in-line with expectations. The company managed to successfully withstand the crypto hangover and datacenter segment's oversaturation, in contrast to Nvidia and Intel. While the guidance was revised slightly to lower numbers, the overall expectations are relatively positive, especially compared to other companies. My price target for AMD stock remains at the level of $30 by the end of 2019."
4237130,2019-01-31,I Expect AMD To Rally,"The post-earnings gap on AMD looks ambiguous; it could be an area gap, but my analysis hints at a breakaway gap. AMD's cognitive dissonance profile shows its investors to be highly optimistic, dampening selloffs while exacerbating rallies. A lexical analysis on the recent earnings call justifies a long position in AMD."
4237575,2019-02-01,AMD: The Growing Bubble,"AMD reported sub-par earnings for Q4 2018. Shares rallied significantly despite the meager results. If current trajectory continues, the stock is likely headed for a cliff."
4237942,2019-02-04,AMD: Expecting Upside,AMD gave a weak Q1 guide. 2019's guide was OK. It may have been better than most. But we'll show that what they said may hint to more.
4237912,2019-02-04,Covered-Call Writing With AMD: My February Trade Setups,"Covered-call writing is one of my favorite strategies to generate monthly income while lowering my cost basis and mitigating downside risk. Due to elevated implied volatility, AMD's options chain generate compelling time value returns following the reaction on its latest earnings report. In this article, I'll discuss a defensive (in the money call) and a more aggressive (out of the money call) setup."
4237871,2019-02-04,AMD: EPYC'ly Setting The Bar,
4238190,2019-02-05,AMD: Share Gain Story,
4238574,2019-02-06,AMD: Good News And Bad,Major holder updates investors on its position. My thoughts on the recent earnings report. Looking for clarity on cash uses.
4239836,2019-02-11,AMD Underreacts (To Guidance),
4241483,2019-02-15,AMD: Closing The Gap (The Best Is Yet To Come),AMD will close the gap with Nvidia introducing its GPU code named Navi. A cash infusion of $448.5 million will go a long way funding R&D and/or paying down debt. $805 million of debt will be diluted away shortly.
4241845,2019-02-18,Meridian Contrarian Fund Q4 2018 Commentary,"Meridian funds have been investing for their shareholders with an eye toward the long term. ArrowMark Colorado Holdings serves as the investment adviser to the Meridian Funds and brings a management team with decades of experience in both traditional and alternative investment management. Includes detailed analysis of Meridian Contrarian Fund's positions in NKTR, AMD, GPK, NEM, MLNX, and BNFT. The Meridian Contrarian Fund (the “Fund”) returned -18.70% (net) for the quarter, underperforming its benchmark, the Russell 2500 Index, which returned -18.49%."
4242495,2019-02-20,AMD's Stock May Jump On Higher GPU Prices,"AMD's options have seen some bullish betting in recent days. The technical charts are pointing to a potential breakout. GPU prices have been on the rise, suggesting inventories may be thinning out."
4242524,2019-02-20,AMD: Blockchain Rebound,"AMD revenues were hit hard in 2018 by the sharp declines in blockchain-related revenues. Surging cryptocurrency prices have the potential of reigniting the blockchain market. The company expects 13%-plus revenue growth in 2019, ex-blockchain. A blockchain tailwind would provide another path for achieving my 2020 targets of $10 billion revenues and $1.50 EPS."
4242505,2019-02-20,My Final AMD Article - I Was Wrong,
4242682,2019-02-21,AMD: The Big Guys Just Love It,"Most of AMD's largest institutional investors increased positions in the chipmaker in the last reporting cycle. Analysts, too, seem to be bullish on the chipmaker. They've gradually raised their EPS targets for the chipmaker over the past 90 days. I would recommend readers and investors to ignore the noise and consider accumulating shares of AMD."
4244084,2019-02-25,AMD's Long-Term Target Prices,"Street analysts have been very optimistic about AMD’s long-term fundamentals, assuming China uncertainty, crypto weakness, and the Fed’s tight interest rate policy will become headwinds blown over by 2H 2019. Wall Street’s wisdom expects that AMD’s Ryzen and EPYC chips will continue to be the key drivers for sales growth. AMD’s strategy of regaining CPU market share through lower-end server CPUs has paid off at the expense of a structurally lower margin than Nvidia and Intel. Invading into Intel’s dominated high-end corporate IT server space and data center allows AMD to expand its margin in the low 40%'s by early 2020. Based on the optimistic forecast fundamentals, AMD’s longer-term stock price path can be sketched out to hit $33 one year out and $38 by 2021."
4244870,2019-02-27,AMD: Upside Momentum Ahead,"AMD's success in obtaining data center market share with EPYC has led to high expectations for EPYC 2, likely to hit the market this quarter or next. Product release hype often fuels short-term rallies in AMD, as per my analysis of stock price reactions after novel information hits the market. In addition, AMD has rallied 26% since earnings, and this rally has produced what appears to be sustainable upward momentum. The recent up gap in AMD is likely a breakaway gap and bolstered by other technical as well as fundamental catalysts - options can help you leverage the breakaway gap."
4247478,2019-03-08,How Much Market Share AMD Needs To Be A $30 Stock,"AMD’s share price has been moving as if there is a zero-sum gain between Intel and AMD’s CPU market share. Historically, AMD stock price changes have been more related to market share changes than to revenue changes. Aided by EPYC Naples and incoming Rome, AMD server market share has reached to 3.2% in 4Q 2018 and looks to “take 3 generations to gain server market shares.”. With a current PC total revenue market share at 8.5%, the Street’s consensus estimates predict that AMD’s market share may reach 10% in late 2020. For every 1% gain in total market share, AMD share price will increase by $0.66. For AMD to reach $30 a share, its market share has to increase to 20%."
4247790,2019-03-11,Intel Vs. AMD: Battle For Market Share,"2018 was a great year for both Intel and AMD, particularly in the CPU market. AMD's top-line increased 23% as they gained market share from Intel, while Intel themselves managed a 13% revenue increase by inflating their CPU prices on the market. My forecast of the CPU market share between these two rivals for the next 4 years indicates their monopoly of the market may be ending. I identified a significant threat to the traditional x86 CPU market in the rise of ARM-based processors which are rapidly creeping into the market."
4248145,2019-03-12,Advanced Micro Devices: The Better Data Center Play,Nvidia bought Mellanox for premium to advanced high-performance computing in data centers. AMD trades very favorably compared to Mellanox at the buyout price of $125 per share. The overlooked AMD story is vast gross margin improvements from sector low levels of 40% to industry norms above 60%.
4249263,2019-03-16,AMD: Advanced Mass Delusions,Advanced Micro Devices continues to ride on all hope without delivering an iota of results. The price increase alongside weakening backdrop going into results presents another compelling shorting opportunity. We break down what we expect and why this short can be a great hedge to your portfolio.
4250237,2019-03-21,AMD's Stock May Go Significantly Higher,AMD is breaking out based on the technical chart. Volatility for the stock will continue to be elevated. Options betting suggests the stock can continue to rise as well.
4250200,2019-03-21,AMD Shorts: A Mass Exodus,"Short interest in AMD has been steadily declining for many months now. The company isn't heavily shorted, at least not when compared to some other names within the semiconductors space. The chipmaker may still be faced by challenges but it seems to have multiple growth catalysts that can bolster its growth over the years to come."
4251535,2019-03-28,Advanced Micro Devices And Google Stadia: When Reality Sets In,"AMD shares surged over 20% on the news of Google using custom graphics chipset from AMD in its upcoming Stadia online gaming. The news initially didn't move the needle for Google, but the hype caught up with Google the following day as well. Google will be the latecomer competing against incumbents with years of gaming experience. Even if wildly successful, this endeavor may end up being severely cannibalistic for AMD."
4252631,2019-04-03,AMD: Where Can This Thing Go?,"We recently wrote that we thought AMD was being too conservative. Data coming out may confirm they were way too conservative. But nobody's looking at 2020 yet. We are, and wow."
4253319,2019-04-08,AMD Vs. Google: CPUs Vs. Streaming,AMD is not the choice CPU for Google's Stadia - this was (erroneously) taken as bad news in the market. Serious gamers - those willing to spend their hard-earning cash on CPU-heavy products - are not taking Stadia seriously. Pre-earnings drift implies excess returns of 2% for investor buying one month ahead of earnings.
4253285,2019-04-08,Crash Protection For AMD,"Shares of AMD have rocketed 74% since the market's December low. In the event they come tumbling back down to earth, I present two ways AMD shareholders can stay long while locking in some gains. I also note why my site is a bit more bullish on Intel than AMD currently."
4253649,2019-04-09,AMD: The ABCs Of A Better 2H 2019,"AMD’s market and financial data give three clues why there will be a better 2H 2019. AMD stock price jumped despite unfavorable Q1 and Q2 revenue estimates but with an upward revision on the Q3 revenue estimate, ignoring the present but focusing on the future. AMD stock rallied amid subsequent simultaneous upward revisions of Q1, Q2, and Q3 revenue estimates. This is a classic Dow’s Confirmation Theory, signaling a reversal in sight. A declining finished goods and work in progress inventory and a rising raw material inventory suggest that both product market and management forecast improve into 2H 2019. Aside from a different issue whether the positive outlook has been baked into stock prices, we are confident that a better 2H 2019 is real for AMD."
4253641,2019-04-09,AMD: Untold Margin Story,AMD takes a hit from $30 despite a bullish analyst call with a $35 target. Most analysts continue to under estimate the gross margin upside for the chip company. The 2020 base case is the average analyst estimates for $8.25 billion in revenues and $1 EPS. The EPS upside is $2-plus based on higher margins from market share gains.
4254705,2019-04-16,Why Computex Is A Positive Catalyst For AMD's Stock,AMD is widely expected to announce a new Ryzen chip. Mid-range Navi GPU refresh expected. Revenue growth prospects improve after product announcements at Computex.
4255083,2019-04-18,AMD Earnings: Brace For Impact,"AMD reports its first quarter earnings in two weeks. Investors should closely monitor AMD's shipment and ASP trends, the magnitude of its OEM design wins and its server market share gains in its Q1. The analyst consensus and management's guidance are coinciding, which suggests that neither of the two is going overboard with their estimates."
4255815,2019-04-22,AMD Bonds Are Too Expensive,"Even with their disappointing Q4 financials, AMD’s stock has still managed to advance more than 50% in 2019. Many argue that AMD stock is overvalued. As AMD’s B+ rated junk bond prices correlate with AMD stock prices, the mispricing of their bonds, if any, may give clues about AMD stock’s mispricing. AMD 7% 2024 bond yield is 100 basis points lower than the comparable, so the bond is 5% overvalued. 5% bond mispricing is significant, considering AMD's annual bond yield is around 6%. More importantly, AMD junk bond overvaluation may suggest AMD stock's overvaluation."
4255990,2019-04-23,Nvidia Vs. Xilinx: Heavy Hitter AI Stocks,"The size of this AI and ML economy is expected to reach $15 trillion by 2030, up from $2 trillion this year. We are in the critical years where startups must quickly design and develop AI if they want first-mover advantage. This is creating a battle between FPGAs and GPUs. Nvidia is one of my favorite companies from a fundamental standpoint and Xilinx also makes a solid investment if/when you can secure the right entry point."
4257149,2019-04-26,Xilinx: What Happens When One Of Our Picks Falls Off A Cliff,"Xilinx was one of the top ten Portfolio Armor names I shared with Marketplace subscribers on April 18th. It's down 14.78% since, after its profit miss and downgrade this week. Here, I show how the Xilinx hedge in our top names portfolio from April 18th ameliorated that drop. I also address the question of how good my security selection process is, given its miss with Xilinx so far."
4257704,2019-04-29,AMD's Stock May Jump Following Results,AMD may surge following its earnings results on Tuesday. The stock may rise as high as $31.40 following results. The chart and the option point to higher prices.
4257679,2019-04-29,AMD Q1 Earnings: It's All About The Second Half,"Without any positive material information, AMD’s share price has already increased more than 40% from an obviously negative Q4 earnings report. Bulls may have bought in to management’s wishful thinking of a better second half of 2019. The market may have reacted to a friendlier macro environment. For 2H 2019, AMD’s CPU revenue is expected to increase if China's gaming weakness improves. The server market share may increase if cloud-spending cuts improve. AMD’s GPU market share gain may be slowed by Nvidia's Turing launch, their presence in PC GPUs and the AI training. While 3% of AMD’s “air” in share prices has been taken out by Intel's Q1 earnings, the post-earnings price move should largely depend on Dr. Su’s Q3 and Q4 guidance."
4257983,2019-04-30,AMD: Halftime Report,"After the success of a hedged portfolio built around an AT&T position in 2017, I started presenting similar portfolios built around other stocks, including AMD in January. Here, I update the performance of the AMD portfolio halfway through its planned six-month duration. This portfolio is up 6.41% so far, lagging both its components (unhedged) and SPY. I explain why."
4259208,2019-05-02,Xilinx: Looking Beyond The Earnings Report,
4259039,2019-05-02,AMD: Curious Earnings Reversal,"Shares lose gains despite solid report. Was this a market thing or something else? After warrant exercise, balance sheet stronger."
4262671,2019-05-10,AMD: Get On The Hype Train - And Ride,"This quarter was a mixed bag of results. Q3, however, is going to be an epic choo-choo train of hype - brace yourself. How we are playing the hype."
4264896,2019-05-17,AMD May Be Eating Nvidia's Lunch,"Nvidia reported weak data center revenue. AMD's data center appears to be strong. AMD's stock may be heading higher, while Nvidia's heads lower."
4265099,2019-05-19,AMD: Mid-Year Update - Incredibly Strong Performer,"AMD has gone up 50% since I last updated on the investment. The company has done incredibly well since early 2018, when I first recommended it. The company is continuing down its path of innovation and plans to release its next-generation products soon. This should cement the company's lead, especially in CPUs. I recommend investing in AMD for the long-term. The company should continue to reward shareholders well."
4265254,2019-05-20,AMD: David And Goliath All Over Again,"AMD shares are up a staggering 48% YTD, and 134% Y/Y. The fun might just be getting started. The story of AMD is a repeat of David and Goliath. Except this time, AMD is going after two Goliaths, and is winning. AMD's server roadmap, particularly within CPUs, is quite interesting as it taps into a $25 billion addressable market where Intel is the sole provider of solutions. AMD is set to expand significantly over the coming years, and take significant business from Nvidia and Intel. Despite all my optimism on the business's fundamentals, it is difficult to wrap my head around AMD's valuation. Initiating at HOLD, $28 PT."
4266875,2019-05-28,Make AMD Great Again,AMD is done giving up GPU market share to Nvidia. MAGA (Make AMD Great Again) is in full force with the impending release of the Navi GPU. Additional catalysts are in the works to keep the PR on AMD high and (hopefully with that) various trading opportunities.
4266800,2019-05-28,AMD's Stock Is Breaking Out Of Its Slumber,AMD may rise to as high as $31.40 based on the technical chart. The options are also suggesting the stock rises by July. There is evidence that indicates AMD may be taking market shares from Nvidia and Intel.
4267165,2019-05-29,AMD: 7 Reasons To Hop Off This Hype Train,"AMD has been one of the best performing large-cap stocks up 115% over the past year. Investors are focusing on an innovative product pipeline expected to take market share from rivals, while valuation appears exuberant. A number of bearish macro themes, including weakness in the global chip industry, slowing PC market, amid demand uncertainty, should be discounted in the stock price outweighing current momentum. 5G-powered low-latency cloud-based gaming could disrupt the PC and console GPU market over next decade, threatening AMD's model."
4267110,2019-05-29,AMD: Valuation On 35x Forward P/E,"Compared with Intel and Nvidia, AMD recent share price has been largely unmoved by the macro picture and industry-specific factors. It appears that the market has priced in AMD’s ability to steal Intel’s CPU and Nvidia’s GPU market share with EPYC growth, the launches of 7nm products and Navi. Using a revenue perspective, AMD’s fair value should be between $26 and $32. AMD is undervalued by 5%-10%. Using an earnings perspective, AMD’s fair value should be between $21 and $24.  AMD is overvalued by 15%-20%. The fact that AMD currently trades closer to the revenue-based fair value suggests that investors still value AMD’s market share over its profitability."
4267283,2019-05-30,AMD: Latest Campaign Has Several Targets,"After reaching 50 years of corporate live, AMD has several key """"50"""" targets. A $50 stock would be a new all-time high for that a stock that peaked in 2000. A 50% gross margin would allow the company to smash 2021 EPS estimates of $1.12. The stock is cheap at $26 as the market realizes that gross margins are headed towards 50%+."
4267121,2019-05-30,AMD: Big Investors Are Bulking Up,"Institutions grew more bullish on AMD in the last 13F reporting cycle. The stock is still trading in the same price-range, in which institutions accumulated their shares, so retail investors can still enter AMD and have same cost-basis as the big guys. Readers and investors should consider going long on the stock."
4269203,2019-06-07,AMD: Why We Covered Our Short Position,Being perfectly right on the fundamentals and wrong on price action is no fun. We follow up on our earlier report on Advanced Micro Devices Inc.'s earnings expectations. The stock is incredibly expensive for falling earnings. But we still covered our short. We explain why.
4269703,2019-06-11,New Product Launches At E3 Set Advanced Micro Devices Up For A Great Year Ahead,
4269996,2019-06-12,"AMD: Bright Future, Low Margin Of Safety",
4269967,2019-06-12,AMD's Gamble Now Paying Off,"It's great for consumers and businesses to see a truly rejuvenated AMD, because it inevitably forces competitors to get better, which in turn, leads to better products from all the major players, as well as a more dynamic computing market. To be clear, AMD still needs to execute on the broad vision that it has laid out for itself - and unfortunately, execution issues have slowed the company in the past. Still, it's encouraging to see some key strategies driving new opportunities, and it will be interesting to see what AMD is able to do with them as we head into the future."
4271157,2019-06-19,Xilinx Is Poised To Outperform As Rapid Technological Innovation Continues,
4271556,2019-06-21,AMD: Price To Book Shows More Upward Movement Coming,"Book value outpacing the upward trend in share price is a positive sign. Quality and competitive pricing of new products confirm this bullish sign. The market has not yet caught up with the surges in net assets, meaning sharp rises in share price are imminent. AMD is, therefore, a strong buy right now."
4271856,2019-06-24,Lofty And Cyclical AMD Is 'The Big Short',"The stock is an unbelievable short candidate. It combines a lofty price and cyclically favourable conditions that will reverse and turn the company to loss. Long expiration, far out of the money put options are the best way to exploit this overvalued stock. The strategy can also be used as a hedge against a possible coming recession or stock crash."
4272070,2019-06-25,AMD: Forced Out Of China,The China joint venture is kaput. The U.S. government has all but shut down the joint venture. The market has overreacted and this gives us an opportunity. How we are adjusting fire to take advantage of this situation.
4271927,2019-06-25,Xilinx: 5G And The Huawei Ban,"The 5G rollout requires FPGAs, which should benefit Xilinx as the number one supplier of re-programmable integrated circuits. The trade war and the banning of Huawei could offset the benefits Xilinx was set to receive from carriers upgrading to 5G networks. Demand for Xilinx may have been artificially inflated due to Chinese companies stocking up in anticipation of possible sanctions. Standing on the sidelines is the prudent move as long as Xilinx is surrounded by unresolved issues that could pull down forward guidance."
4272299,2019-06-27,AMD: I Like Money,
4272747,2019-06-28,It's Time For AMD To Raise Prices,"AMD has made the choice to use a low ASP strategy to increase unit shipment (market share) at the expense of a lower EPS (profitability). Such strategy has proven successful for AMD to increase stock price, although a lower ASP is usually associated with a lower stock price. For every $1 increase in ASP, AMD stock price increases $0.40. AMD’s ASP has already been raised over the critical level that unit shipment will no longer respond to any further ASP increase. The in-elasticity would suggest a great opportunity for AMD to raise its ASP, without the loss of unit shipment, in order to increase revenue, gross margin, EPS, and ultimately the stock price."
4273345,2019-07-03,AMD: Beyond The Thunderdome,Nvidia rebrands the 2080 into the 2070 Super with a massive price cut that pressures AMD Navi GPUs. The 2080 and the 2060 both get refreshes for speed boosts. AMD has a hard battle lined up in the GPU arena. Nvidia brings the GPU pain to AMD. How we are playing this news.
4274507,2019-07-11,AMD Faces Critical Test,Shares looking to break out and avoid triple top. Growth narrative about to shift in a significant way. Improving balance sheet provides possibilities.
4274490,2019-07-11,AMD's Stock May Reach Prices Not Seen Since 2006,AMD is nearing a potentially big breakout on the chart. Options betting has been bullish recently. The stock may be cheap based on projected earnings growth.
4275238,2019-07-16,Nvidia Should Not Wage A Price War Against AMD,"Nvidia has been historically blessed by its superior GPU product performance. Nvidia has a relatively flat demand curve; units demanded is mainly driven by product performance and less by product pricing. Nvidia has felt the increasing pressure to respond to AMD’s new GPU product roll out at a low ASP. Nvidia’s inelastic demand curve suggests that changing prices will have less impact on market share changes. As Nvidia stock price has been typically more responsive to revenue and EPS, not to market share, it would be an ineffective defense for Nvidia to wage a price war."
4275794,2019-07-18,AMD: Hold It And Relax,"AMD is overvalued right now, but it doesn't matter in the long run. It could deliver a 30% annual growth. The current line of products couldn't be better."
4277111,2019-07-24,AMD: Critical Time Approaches,"AMD will be reporting its Q2 earnings on July 30. Investors should pay close attention to its ASP and shipment growth numbers and its management's Q3 guidance in addition to tracking its sales figure for Q2. It's still a good time to be bullish on AMD, but I would recommend investors to remain vigilant to ensure it's actually making progress."
4279868,2019-07-31,AMD Dents Some Growth Hopes,"Q2 revenues slightly beat, but non-GAAP EPS just in-line.
         Q3 revenue guidance disappoints, yearly forecast reduced.
         Stock breakout not likely to happen without outside help."
4279603,2019-07-31,AMD Portfolio: Final Performance,"In January, I presented a hedged portfolio built around a position in Enbridge, designed for conservative investors unwilling to risk a decline of more than 12%. These portfolios last six months, so here I update this one's final performance. This portfolio returned 13.19% over six months, net of hedging and trading costs. This exceeded the 8.25% expected return for our site estimated for it in January."
4280117,2019-08-01,"AMD: Solid Earnings And Credible Google Rumors, Time To Buy","AMD slightly beat revenues, which increased 20% QoQ. Q3 guidance sees both YoY and QoQ increases in revenues. Credible rumors reveal that AMD is likely about to steal Google as a client from Intel. Panic selling after hours upon the earnings release was clearly unwarranted. Take advantage of the cheap shares and buy them aggressively before dumb money regains some perspective."
