id,date,title,summary
4732861,2024-11-04,Nothing Surprising About AMD's Results (Rating Downgrade),"Advanced Micro Devices, Inc.'s results aren't particularly exciting as the company sits near all-time highs. The company is competitive in CPUs and increasing competitiveness in the datacenter, though other segments seem to be suffering. We question whether AMD can gain enough datacenter boost to justify its valuation before we expect margins and revenue growth to slow down."
4732710,2024-11-04,AMD's AI Software Enhancements: The Key To Future Growth,"Advanced Micro Devices, Inc. is making significant strides in software development with its ROCm stack and AI capabilities, aiming to close the gap with Nvidia's CUDA. Its acquisition of Silo AI enhances its AI expertise, potentially positioning it as a viable alternative to Nvidia in AI solutions. The successful launch of AMD's MI300X AI accelerator and its adoption by major hyperscalers like Microsoft, Meta, and Oracle bolster its growth prospects. The company must improve its free cash flow to justify its current valuation."
4732631,2024-11-04,"AMD: Buy The Drop (Technical Analysis, Rating Upgrade)","AMD share prices have dropped substantially following earnings, based largely on forward guidance figures that may have been perceived as weak by the market. A 68% plunge in gaming segment revenues also contributed to the sell-off and overshadowed other aspects of the report that were more positive. Recent price behavior suggests that a potential trend reversal might be in place, as key support levels have been broken during this downturn. Markets seem to be overlooking incredible elements of strength in AMD's data center sales growth, which has now doubled in two consecutive quarters. Recent declines in share prices have improved the stock's risk-reward parameters, and I think AMD looks incredibly compelling right now for investors looking to add exposure in the technology sector."
4733459,2024-11-06,AMD: Second Fiddle As AI Competition Intensifies - Mixed Prospects Ahead,"Advanced Micro Devices is discounted due to its inability to compete directly with NVDA's AI chip dominance, as observed in the former's underwhelming forward guidance. This is on top of the ongoing hyperscaler transition to custom ASICs, with AMD potentially missing out on the generative AI capex boom. Despite promising double-digit growth through FY2026, AMD's impacted operating margins imply its lack of pricing power and delayed AI monetization. While AMD's refreshed PC cycle and Enterprise contract wins offer some optimism, we believe that investors should observe the company's execution for a little longer."
4734887,2024-11-08,AMD: Why I'm Doubling Down,"Data Center revenue hit $3.5 billion in Q3 2024, growing 122% year-over-year, fueled by AI demand. Ryzen processors drove Client segment revenue to $1.9 billion, a 29% year-over-year increase, bolstering AMD’s profitability. Data Center operating income soared 240% to $1.041 billion, reflecting strong margins and high-demand products like EPYC CPUs. Gaming revenue dropped 69% to $462 million, while Embedded fell 25%, impacting AMD’s growth diversification. AMD trades near $140, with a technical target of $196, bolstered by November’s favorable seasonality and momentum indicators."
4736422,2024-11-12,AMD: Lagging AI Growth Shouldn't Last,"Advanced Micro Devices, Inc.'s Data Center revenue is surging due to AI demand, but overall growth lags Nvidia, impacting stock performance. Gaming and Embedded segments are struggling, but Data Center sales are expected to drive future growth, with no sizable segment dragging the business down going forward. AMD stock only trades at 21x '26 EPS targets with substantial upside to estimates, if new GPUs like the Mi350 take market share at lower price points."
4736136,2024-11-12,Why The Market Doesn't Care About AMD's AI Revenue,"Despite its strong AI accelerator technical performance, Advanced Micro Devices, Inc. struggles to compete effectively in terms of market share and absolute dollars. Its Data Center operating margins aren't competitive internally, let alone against Nvidia. AMD requires significantly more R&D as a percent of revenue to be a distant second than Nvidia requires maintaining the lead. If you're investing in AMD for its AI financial performance potential, you're better off elsewhere in the AI investment landscape."
4736233,2024-11-12,AMD: Recent Correction Provides New Opportunity,"AMD’s recent earnings result showed strong potential for its Data Center business and, specifically, its AI chips. The company projected $5 billion in AI chip revenue for 2024, which is up from $4.5 billion in earlier projections. AMD is in a good spot to deliver over $10 billion in AI chip revenue in 2025 and will likely be a main competitor for Nvidia in this segment. AMD’s forward P/E ratio for fiscal ending Dec 2026 is close to 20 compared to Nvidia’s P/E ratio of 30, making AMD significantly cheaper and with strong tailwinds."
4737650,2024-11-14,Unattractive AMD Chart Pattern And Valuation Still A Sell,"AMD's stock has severely underperformed in 2024 despite AI chip success, lagging behind NVIDIA and the broader semiconductor sector. Technical indicators show a lack of buying interest matched against significant selling volumes, with troubling EMV, Force Index, and Chaikin Money Flow readings. Operating risks include the effects of potential trade wars and geopolitical tensions with China, which could severely impact AMD's chip supply and stock performance. I remain bearish on AMD for the next 12 months, rating it a Sell, with a suggestion to look elsewhere for investment opportunities."
4738696,2024-11-19,AMD: Generational Buying Opportunity,
4738659,2024-11-19,AMD: The Overvalued AI Laggard,"Advanced Micro Devices, Inc.'s AI revenue growth appears impressive only until Nvidia enters the conversation. AMD's inventory issues are snowballing, and the company plans a 4% workforce reduction, contrasting Nvidia's aggressive headcount expansion. AMD is significantly overvalued with a fair share price of $87, while the current price is $139, indicating a 37% downside potential."
4739301,2024-11-21,AMD: It's Like 2017 All Over Again,"AMD's growth in AI data center GPUs, driven by strong product launches and a robust roadmap, positions it to challenge Nvidia's dominance. Despite missing Q4 expectations, AMD's sequential growth and expanding operating margins highlight its potential for significant revenue and EPS growth in 2025. The market's pessimism mirrors 2017, but AMD's strong product lineup and undervaluation, just like in 2017, presents a compelling buying opportunity. I recommend a Strong Buy for AMD, expecting it to deliver 20-25% y/y growth and EPS growth of 60% in 2025."
4740677,2024-11-27,Why AMD Stock Is A Gift At $138 (Technical Analysis),"Advanced Micro Devices, Inc. is undervalued at $138, with significant profit growth potential, especially in the booming data center segment. AMD's data center sales surged 122% YoY in Q3, driven by the MI300 accelerator, positioning it as a strong competitor to Nvidia Corporation. Despite short-term technical challenges, AMD's fundamentals are robust, with expected profit growth of 54% in 2024, making it a compelling investment. Nvidia's supply constraints offer AMD a springboard opportunity to capitalize on its data center GPU market, enhancing its long-term growth prospects."
4741194,2024-11-29,AMD Downgrade: Don't Make The Mistake Of Buying Just Because It's Cheap,
4741595,2024-12-02,AMD Throws Up A Bull Flag (Technical Analysis),"Advanced Micro Devices, Inc.'s price action shows positive technicals, with a bullish flag pattern having emerged in the last few months. Currently, AMD has retraced 39.39%, forming a full bull flag pattern, suggesting a continuation of the previous bullish trend. There is a healthy support level below, in case of fundamental changes to the stock that may negatively impact it. This article also reviews oscillators and momentum signals for AMD."
4741543,2024-12-02,AMD Stock: I'm Buying This Dip,
4741489,2024-12-02,AMD: New Highs In 2025? Don't Be Surprised,
4741814,2024-12-03,AMD: Positioned For Takeoff As 2025 Demand Gains Momentum,"Advanced Micro Devices, Inc.'s Q3 2024 earnings pullback is a dip-buy opportunity due to strong AI and data center momentum, with data center revenue surging 122% YoY. Significant customer wins with Meta and Microsoft validates AMD's AI capabilities, positioning it for continued market share gains and robust growth in AI accelerators. AMD's valuation, despite being higher than the sector median, is justified by its exceptional execution, strong profitability metrics, and superior growth prospects in AI and data centers. Risks include competition from Nvidia and Intel, potential custom silicon solutions from hyperscale customers, and manufacturing capacity constraints, but AMD's strategic investments and product roadmap mitigate these risks."
4741743,2024-12-03,AMD: Strong Fundamentals Are Fully Priced In,"Advanced Micro Devices' data center product adoption is driving strong growth and margin expansion. This is likely to continue with the acquisition of ZT Systems. Data on guidance surprises vs consensus and normalized EPS estimate revisions suggests that the stock's growth prospects are fully priced in. Valuations are also near fair value levels, both relative to AMD's historical valuation multiples band and its sectoral peers. Relative technicals too suggest a pause to the uptrend as the stock is starting to range at a key 12-monthly resistance vs the S&P 500. A look at the net working capital intensity reveals that the EBIT margin growth over the past year is purely optical as the operating cash flow margins have been stable."
4743717,2024-12-11,AMD: 2 Reasons To Be Greedy When Others Are Fearful,
4743571,2024-12-11,AMD Is Back In The Buy Zone (Rating Upgrade),
4744645,2024-12-16,AMD Looking To Avoid New Low,
4744564,2024-12-16,"Advanced Micro Devices: Santa Gave Me A Christmas Gift, And I'm Buying The Dip","AMD's recent underperformance is due to competition and market skepticism, but I believe it remains undervalued and poised for growth in 2025. AMD's competitive AI Accelerator GPU roadmap and market share gains against Intel in CPUs highlight its strong fundamentals and growth potential. Financials show robust data center revenue growth and improving operating leverage, suggesting AMD's margins will improve significantly in 2025. Trading at a lower P/E ratio than peers, AMD is undervalued with a potential 27% upside, making it an attractive investment opportunity."
4745155,2024-12-18,AMD's New AI Chip Patent Is More Bad News For Nvidia,"Advanced Micro Devices, Inc.'s stock has declined over 20% in six months, while other chip stocks have kept on rallying. The market may be making a huge mistake by discounting AMD from the AI race. AMD's new chiplet patent could revolutionize AI GPU technology by providing a more cost-effective alternative to Nvidia's GPUs. Despite risks and high expectations, AMD's proven track record, promising technology, and fair valuation present a compelling investment opportunity."
4744981,2024-12-18,Advanced Micro Devices: A No-Brainer Buy For Long-Term Value Investors In 2025,"AMD stock is a no-brainer buy for long-term value investors for 2025, despite weak technical indicators and recent Wall Street downgrades. AMD's data center revenue is expected to drive significant growth, mirroring Nvidia's trajectory from 1.5 years ago, with margins set to rise due to high OPM in data centers. Recent Wall Street downgrade looks to be a reaction to share price decline rather than fundamentals. Market share concern is less critical given rapid growing AI demand. AMD's valuation is compelling, trading at an 18% discount to Nvidia despite comparable 50+% earnings growth in 2025. My DCF model estimates a fair value of $163 for AMD. Strong Buy."
4745680,2024-12-20,AMD Stock: Here's Why It's Dropping And Here's Why I'm Buying (Rating Upgrade),"Advanced Micro Devices, Inc. stock has struggled over the last 12 months and has recently sold off further. The company has made impressive strides in maintaining its lead in the server CPU market and closing the gap with Nvidia in the GPU accelerator market. Shares offer favorable risk-reward at these levels."
4745457,2024-12-20,AMD: Don't Be Fooled By The Naysayers,"AMD stock has struggled to regain momentum as investors are increasingly concerned about its AI growth inflection. Broadcom and Marvell unveiled robust AI revenue outlook recently, corroborating their positions as significant challengers against AMD. Nvidia's Blackwell AI chips are expected to scale and move into volume production and delivery through 2025, heightening AMD's execution risks. AMD management needs to provide a convincing answer to the market's concerns with a solid FY2025 AI revenue outlook. I argue why, while these concerns are valid, the market isn't foolish, as it has already baked in significant pessimism."
4745904,2024-12-22,AMD: Operating Income And EPS Trajectory Expected To Improve,"AMD has good and stable management, which is becoming its core strength as Intel searches for another CEO. Most analysts are estimating close to $10 billion in AI revenue by AMD for 2025, which could be an underestimate as new chips are launched next year. The demand for these chips remains very strong and AMD provides a good value alternative to Nvidia’s AI chips. AMD stock is trading at less than 17 times the EPS estimate for the fiscal year ending Dec 2026 despite showing a strong EPS growth runway."
4746193,2024-12-24,Why AMD's 2025 Could Be Worse Than 2024: AI Dreams Are Crumbling,"AMD faces significant competitive headwinds in AI and GPU markets, struggling against NVIDIA's dominance and custom silicon solutions from major cloud providers. Nvidia continues to dominate the business for AI accelerators, which could limit AMD’s projected market share at below 5%, especially as benchmark data for MI300X disappoints. AMD's PC processor market may see a slowdown in 2025, with Intel and Qualcomm posing tough competition, especially in enterprise segments. As MI300X reality disappoints against the expectations, AMD's valuation premium should slowly fade. Personally, I would expect AMD shares to trade down to 20-25x P/E."
4746192,2024-12-24,AMD: Well-Positioned To Capitalize On New AI Paradigm,"Advanced Micro Devices has transformed into a major player in the data center, enterprise-grade CPU, GPU, and adaptive SoCs markets, despite recent underperformance. The AI revolution, particularly OpenAI's o3 breakthrough, positions AMD's Zen-based EPYC processors and Instinct GPU accelerators for significant future growth. The Company's competitive strengths lie in its x86 CPU designs and advanced GPU architectures, with significant adoption among major cloud providers and enterprise clients. Despite risks from NVIDIA's ecosystem and industry cyclicality, AMD's accelerating momentum in AI hardware and data center segments suggests strong growth potential."
4746348,2024-12-25,AMD: The Valuation Makes No Sense,"AMD's shares have dipped below $120 recently, presenting an attractive risk profile despite the creation of negative investor sentiment. AMD's Data Center segment shows promising growth potential with the MI300X chip, positioning it to compete with Nvidia's dominance in the AI GPU market. AMD's valuation at a P/E ratio of 24.4X offers a 22% discount compared to Nvidia, making it an attractive buy before a potential recovery. AMD's upcoming AI accelerators and burgeoning Data Center business could significantly boost revenues, gross profits, and free cash flows in FY 2025."
4746537,2024-12-26,AMD: A Top Pick For 2025,"AMD is significantly undervalued, despite narrowing the technology gap with Nvidia and raising AI revenue guidance throughout 2024. AMD's potential market share in the AI GPU space could grow, driven by new product releases and partnerships with tech giants like Microsoft and Meta. Technical indicators suggest AMD is oversold, presenting a buying opportunity with a potential 12-month price target of $250, approximately 100% above its current price. AMD's robust EPS growth potential and favorable forward P/E ratios make it a top stock to own in 2025, despite execution and competition risks."
4746448,2024-12-26,AMD Accelerates Product Development To Close The Competitive Gap,
4747076,2024-12-31,Why AMD Stock Offers Both Value And Growth Potential,"AMD's strong fundamentals and market share gains highlight its growth potential in data centers, AI, and CPUs despite Nvidia's dominance. Trading at 27.7x forward earnings, AMD offers upside potential with secular trends and valuation that supports a high margin of safety. Risks like cyclicality and competition remain, but AMD's innovation and strategic partnerships justify its attractiveness for long-term investors."
4747306,2025-01-02,AMD: This Stock Is Way Too Cheap (Rating Upgrade),"I initially covered Advanced Micro Devices, Inc. in June 2024 at $170 and rated it a Hold, but I am upgrading it to a Buy based on a compelling valuation. AMD is currently struggling against Nvidia and Broadcom in the data center GPU market, but this doesn't mean the company is doomed. AMD has a history of breaking into markets and carving out a foothold. It competes with Nvidia in gaming hardware and disrupts Intel's monopoly in server CPUs. Considering strong data center sales growth, a reasonable valuation, and a strong PEG ratio, I upgrade AMD to a Buy."
4747789,2025-01-05,AMD: A Strong Buy As AI Datacenter Ramps Up In 2025,"Nvidia currently dominates the AI datacenter market with over 90% market share, but Advanced Micro Devices is gradually improving its hardware and software offerings to compete. AMD's recent releases, like the MI325X and upcoming MI350 series, show promise, with faster release cycles and significant customer interest. AMD's diversified revenue streams, including CPUs and GPUs, provide a cushion against potential slowdowns in AI hardware CapEx, unlike Nvidia's heavy reliance on datacenter GPUs. With a strategic focus on economic models and a potential market share increase to 10–15%, AMD's valuation appears attractive compared to Nvidia."
4748012,2025-01-07,AMD Stock: Time To Get Aggressive,"Despite recent underperformance, I'm upgrading AMD from just """"Buy"""" to """"Strong Buy"""" today. AMD's upcoming offerings for AI needs and plans to integrate FPGA-powered AI inference engines into its CPUs should give AMD an edge over peers in the hardware end-market. I expect a continued recovery in the non-data-center business units - the prospective EPS growth rates indicate a substantial level of undervaluation. My technical analysis supports a bullish stance. AMD deserves a """"Strong Buy"""" rating - I think investors who are looking to gain exposure to cheap but high-quality AI tech space representatives should take a look."
4748350,2025-01-08,"Only Room For The Best Or Cheapest, And AMD Is Neither: Downgrading To Sell","We're downgrading Advanced Micro Devices, Inc. to Sell as CES 2025 confirmed our belief that the company continues to lag Nvidia in the AI design win cycle. We had expected an intra quarter trade for AMD after AI expectations got tampered last quarter, but we no longer believe this to be the case. AMD is not the best nor the cheapest solution, and hence we see little room for it to compete meaningfully. AMD's premium multiples are also unjustified at current levels, in our opinion. Our take is that investors should take advantage of the post-CES boost in investor confidence and explore windows out of the stock."
4748834,2025-01-10,AMD: An Attractive Valuation Despite AI Skepticism,
4748786,2025-01-10,"AMD: The Time To Buy Is Near (Upgrade, Technical Analysis)",
4748777,2025-01-10,AMD: Stop The Wishful Thinking And Face The Reality,"Many bullish investors have recently argued that Advanced Micro Devices, Inc. is a stock worth buying given its cheap valuation, although the shares are rightfully trading at a discounted valuation. The bearish risks against AMD have continued to compound, with its technology continuing to lag Nvidia’s offerings, while we simultaneously witness the rise of the ‘custom silicon’ wave. Amid the ‘custom silicon’ wave just getting started, investors could allocate more capital to stocks like Broadcom and Marvell Technologies instead, while Nvidia trades at an attractive valuation too."
4748750,2025-01-10,AMD: Expect Bears To Feast On Overhyped Data Center Opportunity,
4748994,2025-01-12,The Sentiment Towards AMD Is Too Negative,"NVIDIA leads in training, while AMD focuses on inference. AMD's open-source approach, cost-effectiveness, and energy efficiency provide competitive advantages over NVIDIA's closed system. Recent acquisitions of Xilinx and ZT Systems enhance AMD's AI inference and datacenter capabilities, positioning it to compete against NVIDIA."
4749190,2025-01-13,AMD: Painful Start To Big 2025,"Advanced Micro Devices, Inc. got hit with several major analyst downgrades, leading to the stock trading at new recent lows, providing a great opportunity. The chip company will report Q424 results in a few weeks with 2025 AI GPU guidance crucial with targets between $8 to $10 billion likely leading to a relief rally. The stock trades at just 23x '25 EPS targets of $5+, but the current consensus estimates appear base case targets with potential upside."
4749197,2025-01-13,AMD's Downcycle Has Begun: Here Is When I'll Start Buying,"Understanding which businesses are deeply cyclical is critical for investors. Every investor who purchased Advanced Micro Devices, Inc. stock in 2024 and still holds is currently underwater despite rising earnings and a positive outlook from AMD. This article explains how this sort of disconnect between fundamentals and stock price can happen, and how investors can avoid the worst pitfalls and profit from them. I share my history with AMD stock as well as my current buying strategy, including the price at which I'll add to my position."
4749183,2025-01-14,AMD: Poised To Keep Falling Further,
4749786,2025-01-15,AMD Q4 Preview: Be Greedy When Others Are Fearful (Rating Upgrade),"AMD's Data Center segment, driven by AI demand, is forecasted to achieve robust revenue growth, contributing to a projected 35% stock CAGR over the next three years. With a 35% margin of safety, an FY2027 price target of $280, and a discounted intrinsic value of $175, AMD's current $115 price represents a strong buying opportunity. Geopolitical tensions (e.g., Taiwan) and recession risks pose challenges, but AMD's AI positioning and my cash strategy offer resilience and support a bullish outlook."
4749909,2025-01-16,AMD: My Highest Conviction Play - Betting Big Again,
4750249,2025-01-17,AMD: The Steal Of The Year Is Already Here,
4750095,2025-01-17,Assessing HSBC's Skepticism: An Unjustified Downgrade; Reiterate Strong Buy On Advanced Micro Devices,"AMD offers less competitive AI GPU than Nvidia is not new news. This explains the 20% valuation discount of AMD to Nvidia. AMD could deliver 30% earnings growth pa assuming market share stays the same, as CEO Lisa Su projects demand for datacenter GPU to grow 60% pa to $500bn by 2028. AMD's PEG is well below 1 in 2025-27E, suggesting AMD is being undervalued rather than overvalued. For long-term value investors, the recent pullback in share price on the back of HSBC's downgrade offers a golden opportunity to buy the stock. Strong Buy."
4750401,2025-01-18,AMD May Need A Reset Before Its Next Rally,
4750497,2025-01-19,AMD Could Skyrocket With Advent Of Reasoning Agents,"Reasoning models like OpenAI's """"o1"""" demand exponentially more inference compute, which benefits AMD due to its superior memory bandwidth and latency capabilities. AI agents could further amplify inference demand, making AMD's hardware crucial for handling these complex, iterative tasks. AMD's modular chiplet design offers significant advantages in managing the increased inference loads, positioning it as a strong investment in the evolving AI landscape. Nvidia's CUDA ecosystem still presents a huge challenge for AMD to overcome."
4750599,2025-01-20,AMD: This Is Dead Money,"Despite strong demand for AI chips, AMD's stock underperformed in 2024 due to rising competition and macro risks. AMD remains undervalued, but it's unlikely that its share will be able to aggressively rebound to its all-time high levels in the foreseeable future. Increased competition from Nvidia and hyperscalers, along with macro risks limit AMD's upside potential."
4750559,2025-01-20,Is AMD The Most Underrated Stock Of 2025,"AMD's shares are under pressure due to AI competition, but the company is gaining market share in server CPUs. AMD's valuation is attractive, trading below its 15-year average P/E, with strong EPS growth expected in the coming years. AMD's AI GPUs cater to cost-sensitive markets, offering a competitive edge against Nvidia's high-end products. Despite some weaknesses in gaming and embedded segments, AMD's data center growth and market share gains from Intel present a strong investment case."
